{
  "manifest_version": "1.0",
  "episode_id": "E004",
  "episode_plan_git_blob_sha": "538a0d55d23dd3188b53f5e33d3d10f8a778c9ce",
  "canonical_prompt_source": {
    "path": "MASTER_PROMPTS.md",
    "section_heading": "## 12. COMPILED PRODUCTION PROMPT"
  },
  "output": {
    "aspect_ratio": "4:5",
    "width": 1080,
    "height": 1350,
    "text_free_raster": true
  },
  "style_refs": [
    "assets/style_refs/v2_current/REF_V2_D_MAIN_CAST_GAEUN_HARIN_TAEMIN.jpeg",
    "assets/style_refs/v2_current/REF_V2_E_3PERSON_INDOOR_SCENE.jpeg"
  ],
  "renderer_contract": {
    "allowed_prompt_bindings": [
      "EXPLICIT_COMPILED_PAYLOAD",
      "CONVERSATION_INFERRED"
    ],
    "reference_conditioning_modes": [
      "BINARY_CONDITIONED",
      "AUTHORITY_INFORMED_NON_BINARY_CONDITIONED"
    ],
    "unexpected_concept_policy": "FAIL_CLOSED",
    "required_reference_conditioning": "BINARY_REQUIRED",
    "style_reference_binding_policy": "ACTUAL_MEDIA_REQUIRED_FOR_PRODUCTION",
    "episode_style_anchor_policy": "REQUIRED_AFTER_STYLE_PASS"
  },
  "batch_policy": {
    "explicit_payload": "FIRST_FRAME_GATE_THEN_BATCH",
    "conversation_inferred": "SEQUENTIAL_EVERY_FRAME_GATE"
  },
  "slides": [
    {
      "index": 1,
      "slide_id": "E004_S01",
      "scene_contract": [
        "Taemin and woman_01 are both present",
        "they are at an ordinary Korean apartment elevator",
        "the elevator doors are open and they are entering together",
        "no dialogue or readable text is baked into the raster"
      ],
      "required_entities": [
        "Taemin",
        "woman_01",
        "apartment elevator",
        "open elevator doors"
      ],
      "forbidden_entities": [
        "dog",
        "bird",
        "animal mascot",
        "coding screen",
        "laptop focus",
        "self-help theme",
        "2x2 collage",
        "readable text",
        "speech bubbles",
        "unrelated third character"
      ]
    },
    {
      "index": 2,
      "slide_id": "E004_S02",
      "scene_contract": [
        "Taemin and woman_01 remain the same identities and clothing",
        "both are inside the elevator",
        "Taemin is operating the floor button panel",
        "the story logic is that woman_01 is going to 21F and Taemin to 17F",
        "no dialogue or readable text is baked into the raster"
      ],
      "required_entities": [
        "Taemin",
        "woman_01",
        "elevator button panel",
        "17F destination logic",
        "21F destination logic"
      ],
      "forbidden_entities": [
        "dog",
        "bird",
        "animal mascot",
        "coding screen",
        "self-help theme",
        "2x2 collage",
        "readable text",
        "speech bubbles",
        "unrelated third character"
      ]
    },
    {
      "index": 3,
      "slide_id": "E004_S03",
      "scene_contract": [
        "the elevator has stopped at Taemin's 17th floor, not the woman's 21st floor",
        "Taemin gestures toward the hallway as if inviting woman_01 to exit first",
        "woman_01 does not exit and remains inside the elevator",
        "Taemin and woman_01 preserve exact identity and clothing continuity",
        "no dialogue or readable text is baked into the raster"
      ],
      "required_entities": [
        "Taemin",
        "woman_01",
        "open elevator doors",
        "17th-floor hallway",
        "Taemin open-palm courtesy gesture"
      ],
      "forbidden_entities": [
        "woman_01 exiting elevator",
        "dog",
        "bird",
        "animal mascot",
        "coding screen",
        "self-help theme",
        "2x2 collage",
        "readable text",
        "speech bubbles",
        "unrelated third character"
      ]
    },
    {
      "index": 4,
      "slide_id": "E004_S04",
      "scene_contract": [
        "woman_01 remains inside the elevator",
        "Taemin is beginning to realize his mistake",
        "the 17F-versus-21F logic remains spatially understandable from context",
        "identity and clothing remain unchanged",
        "no dialogue or readable text is baked into the raster"
      ],
      "required_entities": [
        "Taemin",
        "woman_01",
        "elevator interior",
        "open doorway",
        "mild confusion",
        "Taemin realization"
      ],
      "forbidden_entities": [
        "woman_01 exiting elevator",
        "exaggerated slapstick",
        "dog",
        "bird",
        "animal mascot",
        "coding screen",
        "self-help theme",
        "2x2 collage",
        "readable text",
        "speech bubbles"
      ]
    },
    {
      "index": 5,
      "slide_id": "E004_S05",
      "scene_contract": [
        "only Taemin exits at 17F",
        "woman_01 remains inside for 21F",
        "Taemin's reaction is restrained awkwardness rather than comedic exaggeration",
        "identity and clothing remain unchanged",
        "no dialogue or readable text is baked into the raster"
      ],
      "required_entities": [
        "Taemin",
        "woman_01",
        "17th-floor hallway",
        "elevator doorway",
        "Taemin exiting alone"
      ],
      "forbidden_entities": [
        "woman_01 exiting elevator",
        "dog",
        "bird",
        "animal mascot",
        "coding screen",
        "self-help theme",
        "2x2 collage",
        "readable text",
        "speech bubbles"
      ]
    },
    {
      "index": 6,
      "slide_id": "E004_S06",
      "scene_contract": [
        "Taemin is alone in the 17th-floor hallway foreground",
        "woman_01 remains inside the elevator as the doors close",
        "the scene is quiet deadpan aftermath",
        "no extra gag, moral, mascot, or unrelated prop is added",
        "no dialogue or readable text is baked into the raster"
      ],
      "required_entities": [
        "Taemin",
        "closing elevator doors",
        "woman_01 inside elevator",
        "17th-floor hallway",
        "quiet awkward posture"
      ],
      "forbidden_entities": [
        "woman_01 in hallway",
        "dog",
        "bird",
        "animal mascot",
        "coding screen",
        "self-help theme",
        "2x2 collage",
        "readable text",
        "speech bubbles",
        "motivational ending"
      ]
    }
  ]
}
